Code,Short Description,Tagline,Quantity,Price
MUG0007,coffee mug with LCD level indicator,never again reach for the empty mug,20,49.90
MUG0013,coffee mug with bluetooth-connected coffee grounds scanner for automatized fortune telling,put the smart into coffee reading,20,99.90
OFF3145,pen with pre-warmed ink (tested on the South Pole),the pen is mightier than the cold,50,29.90
COM1001,ambidextrous computer mouse,end the dictate of left and right,10,19.90
COM0404,Easter egg themed webcam for your monitor,put an Easter egg on hardware too,20,149.90
COM0001,Vulcan language vi cheatsheet,learn vi and Vulcan at the same time,3,9.90
COM1536,Klingon language emacs cheatsheet,learn emacs and Klingon at the same time,50,9.90
MOB0555,smartphone case with built-in screen,never miss a message,20,39.90
